{
  "schemaVersion": 3,
  "kind": "timingPulley",
  "units": "mm",
  "rim": {
    "profile": "gt2-2mm-experimental-v1",
    "toothCount": 60,
    "width": 9,
    "radialThickness": 2
  },
  "flanges": {
    "lower": {
      "axialThickness": 1,
      "radialExtension": 1
    },
    "upper": {
      "axialThickness": 1,
      "radialExtension": 1
    }
  },
  "web": {
    "type": "spokes",
    "axialThickness": 4,
    "axialOffset": 0,
    "count": 5,
    "width": 3,
    "filletRadius": 1.5
  },
  "hub": {
    "outerDiameter": 16,
    "lowerExtension": 2,
    "upperExtension": 2
  },
  "bore": { "shape": "keyed", "diameter": 8, "keyWidth": 2, "keyDepth": 1 },
  "generation": {
    "maxChordError": 0.04
  }
}
